<?xml version="1.0" encoding="UTF-8"?>
<workload name="queries" xmlns:xsi="http://www.w3.org/2001/XMLSchema-instance" xsi:noNamespaceSchemaLocation="workload_properties.xsd">
	<collections>
		<collection name="security">
			<files dir="/data/security" firstfileid="1" lastfileid="1" docsperfile="20833" fileprefix="batch-" filepostfix="xml.offset"/>
		</collection>
	</collections>
	<transactions>
		<!--transaction id="1" name="addDocument" weight="25">
			<java-plugin>com.bagri.test.tpox.workload.BagriXDMPlugin</java-plugin>
			<parameters>
				<parameter>
					<files collection="security"/>
				</parameter>
			</parameters>
		</transaction-->

		<transaction id="2" name="getSecurity" weight="50">
			<java-plugin>com.bagri.test.tpox.workload.BagriDBPlugin</java-plugin>
			<parameters>
				<parameter>
					<file>input/security_symbols.txt</file>
				</parameter>
			</parameters>
		</transaction>

		<transaction id="3" name="getSecurityPrice" weight="50">
			<java-plugin>com.bagri.test.tpox.workload.BagriDBPlugin</java-plugin>
			<parameters>
				<parameter>
					<file>input/security_symbols.txt</file>
				</parameter>
			</parameters>
		</transaction>

		<!--transaction id="4" name="searchSecurity" weight="30">
			<java-plugin>com.bagri.test.tpox.workload.BagriDBPlugin</java-plugin>
			<parameters>
				<parameter>
					<file>input/security_sectors.txt</file>
				</parameter>
				<parameter>
					<uniformint min="20" max="23"/>
				</parameter>
				<parameter>
					<uniformint min="25" max="27"/>
				</parameter>
				<parameter>
					<uniformint min="4" max="6"/>
				</parameter>
			</parameters>
		</transaction-->
	</transactions>
</workload>

