<?xml version="1.0" encoding="UTF-8"?>
<workload name="queries" xmlns:xsi="http://www.w3.org/2001/XMLSchema-instance" xsi:noNamespaceSchemaLocation="workload_properties.xsd">
	<collections>
		<collection name="custacc">
			<files dir="/data/custacc" firstfileid="1" lastfileid="2" docsperfile="50000" fileprefix="batch-" filepostfix="xml.offset"/>
		</collection>
		<collection name="custids">
			<ids first="1002" last="101001" />
		</collection>
	</collections>
	<transactions>
		<transaction id="1" name="addDocument" weight="40">
			<java-plugin>com.bagri.test.tpox.workload.BagriDBPlugin</java-plugin>
			<parameters>
				<parameter>
					<files collection="custacc"/>
				</parameter>
			</parameters>
		</transaction>

		<transaction id="2" name="getCustomerProfile" weight="30">
			<java-plugin>com.bagri.test.tpox.workload.BagriDBPlugin</java-plugin>
			<parameters>
				<parameter>
					<ids collection="custids" />
				</parameter>
			</parameters>
		</transaction>

		<transaction id="3" name="getCustomerAccounts" weight="30">
			<java-plugin>com.bagri.test.tpox.workload.BagriDBPlugin</java-plugin>
			<parameters>
				<parameter>
					<ids collection="custids" />
				</parameter>
			</parameters>
		</transaction>
	</transactions>
</workload>

