<?xml version="1.0" encoding="UTF-8"?>
<workload name="insertAccounts" xmlns:xsi="http://www.w3.org/2001/XMLSchema-instance" xsi:noNamespaceSchemaLocation="workload_properties.xsd">
	<collections>
		<collection name="account">
			<files dir="/data/account" firstfileid="1" lastfileid="1" docsperfile="50000" fileprefix="batch-" filepostfix="xml.offset"/>
		</collection>
	</collections>
	<transactions>

		<!--transaction id="1" name="addDocument" weight="100">
			<java-plugin>com.bagri.test.tpox.workload.BagriXQJPlugin</java-plugin>
			<parameters>
				<parameter>
					<constant value="
declare namespace bgdm=&quot;http://bagridb.com/bagri-xdm&quot;;
declare variable $doc external;

let $id := bgdm:store-document($doc)
return $id" />
				</parameter>
				<parameter>
					<constant value="true" />
				</parameter>
				<parameter>
					<constant value="doc" />
				</parameter>
				<parameter>
					<constant value="document" />
				</parameter>
				<parameter>
					<files collection="account"/>
				</parameter>
			</parameters>
		</transaction-->

		<transaction id="1" name="addDocument" weight="100">
			<java-plugin>com.bagri.test.tpox.workload.BagriXQJPlugin</java-plugin>
			<parameters>
				<parameter>
					<constant value="store-document" />
				</parameter>
				<parameter>
					<constant value="false" />
				</parameter>
				<parameter>
					<constant value="content" />
				</parameter>
				<parameter>
					<constant value="document" />
				</parameter>
				<parameter>
					<files collection="account"/>
				</parameter>
				<parameter>
					<constant value="docId" />
				</parameter>
				<parameter>
					<constant value="int" />
				</parameter>
				<parameter>
					<sequence start="1" step="1"/>
				</parameter>
			</parameters>
		</transaction>

	</transactions>
</workload>
