<?xml version="1.0" encoding="UTF-8"?>
<workload name="insertAccounts" xmlns:xsi="http://www.w3.org/2001/XMLSchema-instance" xsi:noNamespaceSchemaLocation="workload_properties.xsd">
	<collections>
		<collection name="account">
			<files dir="/data/account" firstfileid="1" lastfileid="1" docsperfile="50000" fileprefix="batch-" filepostfix="xml.offset"/>
		</collection>
	</collections>
	<transactions>

		<transaction id="1" name="addDocument" weight="100">
			<java-plugin>com.bagri.client.tpox.workload.BagriXDMPlugin</java-plugin>
			<parameters>
				<parameter>
					<files collection="account"/>
				</parameter>
				<parameter>
					<constant value="account" />
				</parameter>
				<parameter>
					<sequence start="100" step="1"/>
				</parameter>
			</parameters>
		</transaction>

	</transactions>
</workload>
