<?xml version="1.0" encoding="UTF-8"?>
<workload name="queries" xmlns:xsi="http://www.w3.org/2001/XMLSchema-instance" xsi:noNamespaceSchemaLocation="workload_properties.xsd">
	<collections>
		<collection name="orderids">
			<ids first="103282" last="603281" />
		</collection>

		<collection name="custids">
			<ids first="1002" last="51001" />
		</collection>
	</collections>

	<transactions>
		<transaction id="1" name="getSecurity" weight="30">
			<java-plugin>com.bagri.test.tpox.workload.BagriXDMPlugin</java-plugin>
			<parameters>
				<parameter>
					<file>input/security_symbols.txt</file>
				</parameter>
			</parameters>
		</transaction>

		<transaction id="2" name="getSecurityPrice" weight="30">
			<java-plugin>com.bagri.test.tpox.workload.BagriXDMPlugin</java-plugin>
			<parameters>
				<parameter>
					<file>input/security_symbols.txt</file>
				</parameter>
			</parameters>
		</transaction>

		<transaction id="3" name="searchSecurity" weight="40">
			<java-plugin>com.bagri.test.tpox.workload.BagriXDMPlugin</java-plugin>
			<parameters>
				<parameter>
					<file>input/security_sectors.txt</file>
				</parameter>
				<parameter>
					<uniformint min="20" max="23" />
				</parameter>
				<parameter>
					<uniformint min="25" max="27" />
				</parameter>
				<parameter>
					<uniformint min="4" max="6" />
				</parameter>
			</parameters>
		</transaction>

		<!--transaction id="4" name="getOrder" weight="15">
			<java-plugin>com.bagri.test.tpox.workload.BagriXDMPlugin</java-plugin>
			<parameters>
				<parameter>
					<ids collection="orderids" />
				</parameter>
			</parameters>
		</transaction>

		<transaction id="5" name="getCustomerProfile" weight="20">
			<java-plugin>com.bagri.test.tpox.workload.BagriXDMPlugin</java-plugin>
			<parameters>
				<parameter>
					<ids collection="custids" />
				</parameter>
			</parameters>
		</transaction>

		<transaction id="6" name="getCustomerAccounts" weight="15">
			<java-plugin>com.bagri.test.tpox.workload.BagriXDMPlugin</java-plugin>
			<parameters>
				<parameter>
					<ids collection="custids" />
				</parameter>
			</parameters>
		</transaction-->
	</transactions>
</workload>

