<?xml version="1.0" encoding="UTF-8"?>
<workload name="queries" xmlns:xsi="http://www.w3.org/2001/XMLSchema-instance" xsi:noNamespaceSchemaLocation="workload_properties.xsd">
	<collections>
		<collection name="order">
			<files dir="/data/order" firstfileid="1" lastfileid="1" docsperfile="500000" fileprefix="batch-" filepostfix="xml.offset"/>
		</collection>
		<collection name="orderids">
			<ids first="103282" last="603281" />
		</collection>
	</collections>

	<transactions>
		<transaction id="1" name="addDocument" weight="50">
			<java-plugin>com.bagri.client.tpox.workload.BagriXDMPlugin</java-plugin>
			<parameters>
				<parameter>
					<files collection="order"/>
				</parameter>
			</parameters>
		</transaction>

		<transaction id="2" name="getOrder" weight="50">
			<java-plugin>com.bagri.client.tpox.workload.BagriXDMPlugin</java-plugin>
			<parameters>
				<parameter>
					<ids collection="orderids" />
				</parameter>
			</parameters>
		</transaction>
	</transactions>
</workload>

