<?xml version="1.0" encoding="UTF-8"?>
<workload name="insertSecurities" xmlns:xsi="http://www.w3.org/2001/XMLSchema-instance" xsi:noNamespaceSchemaLocation="workload_properties.xsd">
	<collections>
		<collection name="security">
			<files dir="/data/security" firstfileid="1" lastfileid="1" docsperfile="20833" fileprefix="batch-" filepostfix="xml.offset"/>
		</collection>
	</collections>
	<transactions>

		<!--transaction id="1" name="addSecurity" weight="100">
			<java-plugin>com.bagri.test.tpox.workload.BagriXQJPlugin</java-plugin>
			<parameters>
				<parameter>
					<constant value="
declare namespace bgdm=&quot;http://bagridb.com/bagri-xdm&quot;;
declare variable $sec external;

let $id := bgdm:store-document($sec)
return $id" />
				</parameter>
				<parameter>
					<constant value="true" />
				</parameter>
				<parameter>
					<constant value="sec" />
				</parameter>
				<parameter>
					<constant value="document" />
				</parameter>
				<parameter>
					<files collection="security"/>
				</parameter>
			</parameters>
		</transaction-->

		<transaction id="1" name="addSecurity" weight="100">
			<java-plugin>com.bagri.test.tpox.workload.BagriXQJPlugin</java-plugin>
			<parameters>
				<parameter>
					<constant value="store-document" />
				</parameter>
				<parameter>
					<constant value="false" />
				</parameter>
				<parameter>
					<constant value="content" />
				</parameter>
				<parameter>
					<constant value="document" />
				</parameter>
				<parameter>
					<files collection="security"/>
				</parameter>
				<parameter>
					<constant value="uri" />
				</parameter>
				<parameter>
					<constant value="string" />
				</parameter>
				<parameter>
					<sequence start="10000" step="1"/>
				</parameter>
			</parameters>
		</transaction>

	</transactions>
</workload>


