<?xml version="1.0" encoding="UTF-8"?>
<workload name="insertCustaccs" xmlns:xsi="http://www.w3.org/2001/XMLSchema-instance" xsi:noNamespaceSchemaLocation="workload_properties.xsd">
	<collections>
		<collection name="custacc">
			<files dir="/data/custacc" firstfileid="1" lastfileid="2" docsperfile="50000" fileprefix="batch-" filepostfix="xml.offset"/>
		</collection>
	</collections>
	<transactions>

		<transaction id="1" name="addDocument" weight="100">
			<java-plugin>com.bagri.client.tpox.workload.BagriXDMPlugin</java-plugin>
			<parameters>
				<parameter>
					<files collection="custacc"/>
				</parameter>
			</parameters>
		</transaction>

	</transactions>
</workload>
